{
  "format": "drivine-model/1",
  "generator": {
    "library": "drivine4j",
    "version": "0.2.0",
    "language": "kotlin"
  },
  "module": "drivine4j-sample",
  "fragments": [
    {
      "id": "org.drivine.sample.fragment.AnonymousWebUser",
      "name": "AnonymousWebUser",
      "labels": [
        "WebUser",
        "Anonymous"
      ],
      "nodeId": "uuid",
      "properties": [
        {
          "name": "anonymousToken",
          "stored": "anonymousToken",
          "type": "string",
          "nullable": false,
          "source": "kotlin.String"
        },
        {
          "name": "displayName",
          "stored": "displayName",
          "type": "string",
          "nullable": false,
          "source": "kotlin.String"
        },
        {
          "name": "uuid",
          "stored": "uuid",
          "type": "uuid",
          "nullable": false,
          "source": "java.util.UUID"
        }
      ]
    },
    {
      "id": "org.drivine.sample.fragment.ChunkNode",
      "name": "ChunkNode",
      "labels": [
        "ContentElement",
        "Chunk"
      ],
      "nodeId": "id",
      "properties": [
        {
          "name": "containerSectionId",
          "stored": "container_section_id",
          "type": "string",
          "nullable": true,
          "source": "kotlin.String"
        },
        {
          "name": "id",
          "stored": "id",
          "type": "string",
          "nullable": false,
          "source": "kotlin.String"
        },
        {
          "name": "text",
          "stored": "text",
          "type": "string",
          "nullable": false,
          "source": "kotlin.String"
        }
      ]
    },
    {
      "id": "org.drivine.sample.fragment.GithubPerson",
      "name": "GithubPerson",
      "labels": [
        "Person",
        "Mapped",
        "GithubPerson"
      ],
      "nodeId": "uuid",
      "properties": [
        {
          "name": "bio",
          "stored": "bio",
          "type": "string",
          "nullable": true,
          "source": "kotlin.String"
        },
        {
          "name": "githubId",
          "stored": "githubId",
          "type": "string",
          "nullable": false,
          "source": "kotlin.String"
        },
        {
          "name": "name",
          "stored": "name",
          "type": "string",
          "nullable": false,
          "source": "kotlin.String"
        },
        {
          "name": "uuid",
          "stored": "uuid",
          "type": "uuid",
          "nullable": false,
          "source": "java.util.UUID"
        }
      ]
    },
    {
      "id": "org.drivine.sample.fragment.GuideUser",
      "name": "GuideUser",
      "labels": [
        "GuideUser"
      ],
      "nodeId": "uuid",
      "properties": [
        {
          "name": "guideProgress",
          "stored": "guideProgress",
          "type": "int",
          "nullable": false,
          "source": "kotlin.Int"
        },
        {
          "name": "uuid",
          "stored": "uuid",
          "type": "uuid",
          "nullable": false,
          "source": "java.util.UUID"
        }
      ]
    },
    {
      "id": "org.drivine.sample.fragment.IssueCore",
      "name": "IssueCore",
      "labels": [
        "Issue"
      ],
      "nodeId": "uuid",
      "properties": [
        {
          "name": "body",
          "stored": "body",
          "type": "string",
          "nullable": true,
          "source": "kotlin.String"
        },
        {
          "name": "id",
          "stored": "id",
          "type": "int",
          "nullable": false,
          "source": "kotlin.Long"
        },
        {
          "name": "locked",
          "stored": "locked",
          "type": "boolean",
          "nullable": false,
          "source": "kotlin.Boolean"
        },
        {
          "name": "state",
          "stored": "state",
          "type": "string",
          "nullable": true,
          "source": "kotlin.String"
        },
        {
          "name": "stateReason",
          "stored": "stateReason",
          "type": "enum",
          "values": [
            "COMPLETED",
            "NOT_PLANNED",
            "REOPENED",
            "UNKNOWN"
          ],
          "nullable": true,
          "source": "org.drivine.sample.fragment.IssueStateReason"
        },
        {
          "name": "title",
          "stored": "title",
          "type": "string",
          "nullable": true,
          "source": "kotlin.String"
        },
        {
          "name": "uuid",
          "stored": "uuid",
          "type": "uuid",
          "nullable": false,
          "source": "java.util.UUID"
        }
      ]
    },
    {
      "id": "org.drivine.sample.fragment.OddlyStored",
      "name": "OddlyStored",
      "labels": [
        "OddlyStored"
      ],
      "nodeId": "id",
      "properties": [
        {
          "name": "greeting",
          "stored": "say \"hi\"",
          "type": "string",
          "nullable": true,
          "source": "kotlin.String"
        },
        {
          "name": "id",
          "stored": "id",
          "type": "string",
          "nullable": false,
          "source": "kotlin.String"
        },
        {
          "name": "path",
          "stored": "back\\slash",
          "type": "string",
          "nullable": true,
          "source": "kotlin.String"
        },
        {
          "name": "price",
          "stored": "price$usd",
          "type": "int",
          "nullable": true,
          "source": "kotlin.Long"
        },
        {
          "name": "rate",
          "stored": "rate%",
          "type": "int",
          "nullable": true,
          "source": "kotlin.Long"
        }
      ]
    },
    {
      "id": "org.drivine.sample.fragment.Organization",
      "name": "Organization",
      "labels": [
        "Organization"
      ],
      "nodeId": "uuid",
      "properties": [
        {
          "name": "name",
          "stored": "name",
          "type": "string",
          "nullable": false,
          "source": "kotlin.String"
        },
        {
          "name": "uuid",
          "stored": "uuid",
          "type": "uuid",
          "nullable": false,
          "source": "java.util.UUID"
        }
      ]
    },
    {
      "id": "org.drivine.sample.fragment.Person",
      "name": "Person",
      "labels": [
        "Person",
        "Mapped"
      ],
      "nodeId": "uuid",
      "properties": [
        {
          "name": "bio",
          "stored": "bio",
          "type": "string",
          "nullable": true,
          "source": "kotlin.String"
        },
        {
          "name": "name",
          "stored": "name",
          "type": "string",
          "nullable": false,
          "source": "kotlin.String"
        },
        {
          "name": "uuid",
          "stored": "uuid",
          "type": "uuid",
          "nullable": false,
          "source": "java.util.UUID"
        }
      ]
    },
    {
      "id": "org.drivine.sample.fragment.RegisteredWebUser",
      "name": "RegisteredWebUser",
      "labels": [
        "WebUser",
        "Registered"
      ],
      "nodeId": "uuid",
      "properties": [
        {
          "name": "displayName",
          "stored": "displayName",
          "type": "string",
          "nullable": false,
          "source": "kotlin.String"
        },
        {
          "name": "email",
          "stored": "email",
          "type": "string",
          "nullable": false,
          "source": "kotlin.String"
        },
        {
          "name": "uuid",
          "stored": "uuid",
          "type": "uuid",
          "nullable": false,
          "source": "java.util.UUID"
        }
      ]
    },
    {
      "id": "org.drivine.sample.fragment.SampleResolverNode",
      "name": "SampleResolverNode",
      "labels": [
        "SampleResolver"
      ],
      "nodeId": "id",
      "bags": [
        {
          "field": "metadata",
          "prefix": "metadata.",
          "type": "any"
        }
      ],
      "properties": [
        {
          "name": "id",
          "stored": "id",
          "type": "string",
          "nullable": false,
          "source": "kotlin.String"
        },
        {
          "name": "sectionId",
          "stored": "section_id",
          "type": "string",
          "nullable": true,
          "source": "kotlin.String"
        }
      ]
    },
    {
      "id": "org.drivine.sample.fragment.StampedNote",
      "name": "StampedNote",
      "labels": [
        "StampedNote"
      ],
      "nodeId": "id",
      "stamp": true,
      "properties": [
        {
          "name": "id",
          "stored": "id",
          "type": "string",
          "nullable": false,
          "source": "kotlin.String"
        },
        {
          "name": "text",
          "stored": "text",
          "type": "string",
          "nullable": false,
          "source": "kotlin.String"
        }
      ]
    },
    {
      "id": "org.drivine.sample.fragment.WebUser",
      "name": "WebUser",
      "labels": [
        "WebUser"
      ],
      "nodeId": "uuid",
      "subtypes": [
        "org.drivine.sample.fragment.AnonymousWebUser",
        "org.drivine.sample.fragment.RegisteredWebUser"
      ],
      "properties": [
        {
          "name": "displayName",
          "stored": "displayName",
          "type": "string",
          "nullable": false,
          "source": "kotlin.String"
        },
        {
          "name": "uuid",
          "stored": "uuid",
          "type": "uuid",
          "nullable": false,
          "source": "java.util.UUID"
        }
      ]
    },
    {
      "id": "org.drivine.sample.view.SampleArticleNode",
      "name": "SampleArticleNode",
      "labels": [
        "SampleArticle"
      ],
      "nodeId": "id",
      "properties": [
        {
          "name": "body",
          "stored": "body",
          "type": "string",
          "nullable": false,
          "index": "fullText",